{
  "$schema": "https://json-schema.org/draft/2020-12/schema",
  "$id": "https://forgerail.dev/schemas/rule-claim-v1.json",
  "title": "ForgeRail Rule Claim v1",
  "type": "object",
  "additionalProperties": false,
  "required": ["schemaVersion", "claimId", "workspaceIdentityId", "sourceId", "ruleKey", "normalizedValue", "precedenceClass", "applicabilityScope", "observationPoint", "status", "enforcement", "dependencyEdgeIds", "observedAt", "limitedReason"],
  "properties": {
    "schemaVersion": { "const": "1.0" },
    "claimId": { "type": "string", "pattern": "^[a-zA-Z0-9][a-zA-Z0-9._:-]+$" },
    "workspaceIdentityId": { "type": "string", "pattern": "^[a-zA-Z0-9][a-zA-Z0-9._:-]+$" },
    "sourceId": { "type": "string", "pattern": "^[a-zA-Z0-9][a-zA-Z0-9._:-]+$" },
    "ruleKey": { "type": "string", "pattern": "^[a-z][a-z0-9.-]+$" },
    "normalizedValue": {},
    "precedenceClass": { "type": "string", "minLength": 1 },
    "applicabilityScope": { "type": "array", "items": { "type": "string", "minLength": 1 }, "minItems": 1, "uniqueItems": true },
    "observationPoint": { "type": "string", "minLength": 1 },
    "status": { "enum": ["observed", "inferred", "confirmed", "default", "requires-confirmation"] },
    "enforcement": { "enum": ["enforceable", "advisory", "unresolved"] },
    "dependencyEdgeIds": { "type": "array", "items": { "type": "string", "pattern": "^[a-zA-Z0-9][a-zA-Z0-9._:-]+$" }, "uniqueItems": true },
    "observedAt": { "type": "string", "format": "date-time" },
    "limitedReason": { "type": ["string", "null"], "minLength": 1 }
  },
  "allOf": [
    {
      "if": { "properties": { "ruleKey": { "const": "engineering.mode" } }, "required": ["ruleKey"] },
      "then": { "properties": { "normalizedValue": { "enum": ["fast", "balanced", "strict"] } } }
    },
    {
      "if": { "properties": { "ruleKey": { "const": "git.branch.naming" } }, "required": ["ruleKey"] },
      "then": { "properties": { "normalizedValue": { "$ref": "#/$defs/branchNaming" } } }
    },
    {
      "if": { "properties": { "status": { "enum": ["inferred", "requires-confirmation"] } }, "required": ["status"] },
      "then": { "properties": { "enforcement": { "enum": ["advisory", "unresolved"] } } }
    },
    {
      "if": { "properties": { "enforcement": { "const": "unresolved" } }, "required": ["enforcement"] },
      "then": { "properties": { "limitedReason": { "type": "string", "minLength": 1 } } }
    }
  ],
  "$defs": {
    "branchNaming": {
      "type": "object", "additionalProperties": false, "required": ["prefixes"],
      "properties": {
        "prefixes": {
          "type": "object", "additionalProperties": false,
          "required": ["feature", "fix", "maintenance", "documentation"],
          "properties": {
            "feature": { "$ref": "#/$defs/branchPrefixes" },
            "fix": { "$ref": "#/$defs/branchPrefixes" },
            "maintenance": { "$ref": "#/$defs/branchPrefixes" },
            "documentation": { "$ref": "#/$defs/branchPrefixes" }
          }
        }
      }
    },
    "branchPrefixes": {
      "type": "array", "minItems": 1, "maxItems": 32, "uniqueItems": true,
      "items": {
        "type": "string", "maxLength": 200,
        "pattern": "^(?!.*\\.\\.)(?!.*@\\{)(?!.*//)(?!.*(?:^|/)\\.)(?!.*(?:\\.|\\.lock)/)[A-Za-z0-9_][A-Za-z0-9._/-]*/$"
      }
    }
  }
}
